Question,Answer,reasoning
How do I apply for CPT?,You must get approval from your Designated School Official (DSO) and submit a CPT request form along with an offer letter from your employer.,"Question Understanding
The question asks about the application process for Curricular Practical Training (CPT) for F-1 students in the United States. The key legal concept is CPT, a type of work authorization for international students. The jurisdiction is the United States, governed by regulations from the Department of Homeland Security (DHS) and Student and Exchange Visitor Program (SEVP). The implied context is that the person asking is an F-1 student seeking to engage in off-campus employment.

Core Analysis
The main legal framework governing CPT is found within the Code of Federal Regulations (CFR), specifically 8 CFR ยง 214.2(f). CPT is defined as alternative work/study, internship, cooperative education, or any other type of required internship or practicum that is offered by sponsoring employers through cooperative agreements with the school. The regulations dictate that CPT must be an integral part of an established curriculum or a mandatory requirement for graduation.

The first step in applying for CPT is to obtain approval from the Designated School Official (DSO). The DSO is responsible for advising F-1 students on immigration matters and ensuring compliance with SEVP regulations. DSOs are authorized to endorse a student's Form I-20, Certificate of Eligibility for Nonimmigrant Student Status, for CPT.

The student typically submits a CPT request form to the DSO, along with supporting documentation, such as an offer letter from the prospective employer. The offer letter confirms the job description, start and end dates, and the number of hours to be worked. The DSO reviews the request to ensure that the employment meets the requirements for CPT, that it is directly related to the student's major field of study, and that the student maintains F-1 status.

Alternative Perspectives
While the answer correctly identifies the main steps, there can be variations based on the specific institution. Some schools might have additional requirements, such as a minimum GPA, completion of certain coursework, or departmental approval. The timing of the application can also vary depending on the school's internal policies.

Another plausible counterargument relates to the definition of ""integral part of the curriculum."" This can be interpreted differently by different DSOs and academic departments. Some may require formal course enrollment, while others accept experiential learning credits or simply view the CPT as essential for completing the student's program.

Self-Reflection
The provided answer is a good general overview, but it lacks the specific regulatory citation and acknowledges variations based on institutional policies. The alternative perspectives highlight that the application process can be more complex and nuanced than described. While the answer is essentially correct, it could be improved by recognizing the potential for institutional differences and the importance of consulting with the DSO for detailed instructions.

Conclusion Synthesis
The answer correctly identifies the core steps of applying for CPT: DSO approval and submission of a request form with an offer letter. The reasoning is supported by the regulatory framework governing F-1 students. However, the answer should be supplemented by a recognition of the nuances related to different institutional policies and interpretations of the regulations.
"
What documents are required for CPT?,"Typically you need:
- CPT Request Form from your university
- Job Offer Letter from a U.S. employer
- Proof that CPT is part of your academic program
- Valid passport visa and I-94","Question Understanding
The question concerns the documentation required for Curricular Practical Training (CPT), a type of work authorization available to F-1 international students in the United States. It implies the context of U.S. immigration law and regulations governing international students. The key legal concept here is CPT authorization, which is governed by regulations issued by the Department of Homeland Security (DHS). The question seeks a list of necessary documents.

Core Analysis
The core legal framework governing CPT is found in the Code of Federal Regulations (CFR), specifically 8 CFR 214.2(f). This regulation outlines the conditions under which an F-1 student can be authorized for CPT. The Designated School Official (DSO) at the student's university plays a crucial role in the CPT application process.

The documents listed in the answer are generally accurate reflections of what's needed:

1.  **CPT Request Form from your university:** Universities typically have their own forms to initiate the CPT application process. This form ensures the university is aware of and approves the student's request.
2.  **Job Offer Letter from a U.S. employer:** A job offer letter is critical as it proves the student has a qualifying practical training opportunity directly related to their major field of study. The letter should specify the job title, responsibilities, start and end dates, and employer details.
3.  **Proof that CPT is part of your academic program:** CPT must be an integral part of the student's established curriculum. This requirement is usually met through a letter from the academic advisor, course syllabus, or official university documentation confirming the CPT's academic necessity (e.g., required internship).
4.  **Valid passport, visa, and I-94:** These documents demonstrate the student's legal F-1 status in the United States. The passport must be valid, the F-1 visa should be unexpired (though it can be expired if remaining in the US), and the I-94 record confirms lawful entry.

The DSO reviews these documents to determine eligibility and then endorses the student's Form I-20, Certificate of Eligibility for Nonimmigrant Student Status, with the CPT authorization.

Alternative Perspectives
1.  **Optional documents:** While not always required, some universities may request additional documents such as transcripts or proof of enrollment. The exact requirements can vary by institution.
2.  **Form I-20:** Although a valid I-20 is implied by maintaining F-1 status, it is a crucial document in the CPT application process and should be explicitly mentioned. The DSO will update the I-20 with the CPT authorization.
3.  **Social Security Card:** While not required for the CPT application itself, a student will need a social security card to receive wages from their CPT employment.

Self-Reflection
The provided answer covers the essential documents required for CPT. However, it could be more precise by explicitly mentioning the Form I-20 as a crucial document. It is important to acknowledge that university-specific requirements may vary. The response would also benefit from explicitly stating the DSO's role in the process. Despite these minor weaknesses, the core information provided is accurate and helpful.

Conclusion Synthesis
The answer correctly identifies the key documents required for a CPT application: a university request form, job offer letter, proof of academic integration, and evidence of valid F-1 status. While additional documents might be needed depending on the university, and the crucial role of Form I-20 and the DSO could be highlighted more clearly, the answer provides a sound overview of the necessary documentation.
"
How long does CPT processing take?,Processing usually takes 5-10 business days after submission to the DSO.,"Question Understanding
The question asks about the processing time for Curricular Practical Training (CPT) applications. CPT is a type of work authorization for international students (F-1 visa holders) in the United States, allowing them to participate in off-campus employment that is an integral part of their academic curriculum. The question implies that there is a standard processing time. The term ""DSO"" refers to Designated School Official, who is responsible for advising and assisting international students at their university or college.

Core Analysis
CPT is governed by regulations issued by the U.S. Department of Homeland Security, specifically U.S. Code of Federal Regulations (CFR), Title 8, Section 214.2(f). While the regulations outline the eligibility criteria and requirements for CPT, they don't prescribe a specific processing timeframe. The processing time is largely determined by the individual university's international student services office and their workload. The DSO reviews the application to ensure the student meets all eligibility requirements and that the proposed employment is directly related to their major field of study. Universities typically aim to process CPT applications within a reasonable timeframe to allow students to begin their employment. The stated range of 5-10 business days is a common estimate based on typical DSO processing times after all required documents are submitted.

Alternative Perspectives
1. **Varying Institutional Practices**: Processing times may vary substantially among different universities and even within the same university depending on the time of year. Larger universities with higher international student populations might experience longer processing times, particularly during peak periods like the beginning or end of semesters. Some universities may have explicit policies stating their CPT processing times, while others provide only estimates.
2. **Incomplete Applications**: The 5-10 business day timeframe assumes a complete and accurate application. If the student submits an incomplete application or if the DSO requires additional documentation or clarification, the processing time could be significantly longer. Any delays in communication between the student and the DSO can also extend the processing timeframe.
3. **Systemic Delays**: Unforeseen circumstances like system outages, policy changes, or staff shortages could cause delays in processing times that deviate from the norm. While less common, these factors can sometimes impact the speed of CPT processing.

Self-Reflection
The answer provides a general estimate, which is helpful but may not always be accurate. The strength of the answer lies in its reflection of the typical processing time. However, it would be beneficial to acknowledge the potential for variability based on institutional factors and the completeness of the application. While alternative perspectives are valid, the provided answer captures the most common experience for students seeking CPT authorization.

Conclusion Synthesis
The statement that CPT processing usually takes 5-10 business days after submission to the DSO is a reasonable estimate based on common practices. While processing times can vary depending on the university, completeness of the application, and unforeseen circumstances, this range provides a general expectation for students applying for CPT. Remaining uncertainties involve the policies and procedures of individual universities and the potential for unexpected delays.
"
Can I work before receiving CPT authorization?,No you must wait for approval and receive an updated I-20 with CPT authorization before starting work.,"Question Understanding
The question concerns the legality of engaging in work activities before receiving official Curricular Practical Training (CPT) authorization. The question implicitly refers to F-1 student visa holders in the United States. The core legal issue is whether employment without proper authorization violates the terms of the F-1 visa and related regulations.

Core Analysis
The legal framework governing F-1 student employment is primarily found in the Code of Federal Regulations (CFR), specifically 8 CFR 214.2(f). This regulation outlines the conditions under which F-1 students can engage in employment, including CPT. CPT is defined as ""alternative work/study, internship, cooperative education, or any other type of required or optional internship or practicum that is offered by sponsoring employers through cooperative agreements with the school.""

Crucially, 8 CFR 214.2(f)(10) explicitly states the requirements for CPT authorization. The Designated School Official (DSO) at the student's educational institution must authorize CPT. This authorization is documented on the student's I-20 form (Certificate of Eligibility for Nonimmigrant Student Status). Working before this authorization is granted violates the terms of the F-1 visa and can have severe consequences, including the termination of the student's visa status and potential deportation. Unauthorized employment is a violation of immigration law.

Alternative Perspectives
One could argue that if the work is unpaid and purely for academic credit, it might be permissible even before formal CPT authorization. However, this is a risky interpretation. Immigration officials generally view any activity that resembles employment, regardless of payment, as requiring authorization. Even if unpaid, the activity could be considered a violation if it provides a benefit to the employer or displaces a U.S. worker.

Another possible counterargument is based on the timing of the authorization. If a student applies for CPT, and the DSO indicates that the authorization is imminent, the student might be tempted to begin working a few days before the official I-20 is issued. However, this is strongly discouraged. The regulation requires *prior* authorization, and commencing work before receiving the updated I-20 puts the student at risk.

Self-Reflection
The main answer's reasoning is strong because it directly relies on the explicit regulatory language in 8 CFR 214.2(f)(10). The alternative perspectives are weak because they either contradict the explicit requirement of prior authorization or rely on ambiguous interpretations that could be challenged by immigration officials. The risk of violating immigration law outweighs any potential benefit from starting work early.

Conclusion Synthesis
The regulation clearly stipulates that CPT authorization is required *before* engaging in any work activity. Therefore, the answer that you must wait for approval and receive an updated I-20 with CPT authorization before starting work is the correct interpretation of immigration law. While edge cases might exist, relying on them is imprudent and potentially dangerous for an F-1 student.
"
Do I need to pay any fees for CPT?,No CPT does not require a separate application fee to USCIS.,"Question Understanding
The question concerns whether there are fees associated with Curricular Practical Training (CPT) for F-1 students. The implied context is a student in the U.S. on an F-1 visa seeking to engage in off-campus employment related to their field of study. The key legal concepts involved are F-1 visa regulations, CPT authorization, and associated USCIS (United States Citizenship and Immigration Services) fees.

Core Analysis
CPT is an integral part of an F-1 student's academic curriculum, allowing them to gain practical experience directly related to their major field of study. Authorization for CPT is typically granted by the Designated School Official (DSO) at the student's university, not directly by USCIS. USCIS regulations, specifically 8 CFR 214.2(f), outline the requirements for F-1 students, including CPT. Since the DSO, acting on behalf of the university, approves CPT based on academic requirements, there is no separate application process with USCIS that would necessitate a fee. Universities may have internal administrative fees, but these are not USCIS fees. Therefore, there is no fee required by USCIS.

Alternative Perspectives
1. It could be argued that while USCIS doesn't directly charge a fee for CPT authorization, the Student and Exchange Visitor Program (SEVP), which is under the umbrella of the Department of Homeland Security (DHS), indirectly influences costs. SEVP mandates certain compliance requirements for schools that enroll F-1 students, and these compliance requirements translate into administrative costs that schools might pass on to students in some form (though not specifically labeled as a ""CPT fee"").
2. Another argument might be that while there's no direct USCIS fee, failing to properly maintain F-1 status (e.g., working without authorization) could lead to immigration violations and potential legal fees to resolve those issues. This is distinct from a CPT application fee, but represents a potential financial burden related to F-1 status and employment.
3. One could also view the SEVIS (Student and Exchange Visitor Information System) fee, which students pay upon initial entry into the U.S. on an F-1 visa, as indirectly related. While not specifically for CPT, the SEVIS fee covers the cost of maintaining the system used to track F-1 students, which is essential for CPT authorization.

Self-Reflection
The primary answer is strong because it directly addresses the question of whether USCIS charges a separate application fee for CPT. The alternatives, while plausible, address indirect costs or potential consequences of non-compliance, rather than a direct application fee to USCIS. The SEVIS fee is a one-time cost associated with obtaining the F-1 visa, not CPT specifically. The core analysis accurately reflects the process and regulations surrounding CPT authorization.

Conclusion Synthesis
The reasoning supports the final answer that there is no separate application fee required by USCIS for CPT. CPT authorization is granted by the Designated School Official (DSO) at the student's university, based on academic requirements, and does not involve a direct application or fee payment to USCIS. While indirect costs related to SEVP compliance or potential legal fees from non-compliance exist, these do not constitute a direct USCIS application fee for CPT.
"
